{
  "domain": {
    "baseDomain": "localhost",
    "dashboard": "",
    "ssh": {
      "port": 2222,
      "hostname": "",
      "gateway": "sshpiper",
      "listenPort": 2222,
      "upstreamUser": "dev"
    }
  },
  "auth": {
    "github": {
      "clientId": "",
      "clientSecret": ""
    },
    "jwtSecret": "dev-secret-change-in-production",
    "allowedOrg": "",
    "allowedUsers": []
  },
  "server": {
    "mode": "production",
    "port": 4000,
    "host": "0.0.0.0"
  },
  "runtime": {
    "backend": "kubernetes"
  },
  "jobs": {
    "concurrency": 4
  },
  "kubernetes": {
    "namespace": "atelier-sandboxes",
    "kubeconfig": "/etc/rancher/k3s/k3s.yaml",
    "runtimeClass": "kata-atelier-clh-rs",
    "ingressClassName": "",
    "toolIngressClusterIssuer": "",
    "registryUrl": "",
    "storageClass": "",
    "volumeSnapshotClass": "",
    "defaultVolumeSize": "10Gi",
    "vsCodeIngressAnnotations": {}
  },
  "storage": {
    "provider": "csi"
  },
  "sandbox": {
    "defaultImage": "dev-base",
    "agentImage": "ghcr.io/frak-id/sandbox-agent:latest",
    "defaultVcpus": 2,
    "defaultMemoryMb": 4096
  },
  "ports": {
    "terminal": 7681,
    "agent": 9998
  },
  "imageBuilder": {
    "kind": "docker",
    "image": "",
    "endpoint": "",
    "dockerHost": "",
    "platform": "",
    "cacheRepo": "",
    "insecureRegistry": true,
    "tls": {
      "secretName": "",
      "serverName": ""
    }
  }
}
